./data/joconde-MUSEES-valid.csv,2781,Line should have 77 collumn and has 78,"AG012948            |||||||PEINTRE DE NAPLES 1959|FROEHNER (CAT. ANTIQUITES MARSEILLE, 1897, P. 260, 261, NO 1427) ; SCHAUENBURG (PERSEUS IN DER KUNST DER ALTERTURMS, 1960, P. 30 ET P. 98, PL 32, 2) ; TRENDALL (LCS, I, 1967, P. 151, NO 862)|argile beige foncé ; incomplet ; moins le pied ; refait (pied, partie de l'embouchure) ; repeint (nombreux) ; recollé|<A HREF='mailto:laurent.olivier@culture.gouv.fr?Subject=Contact base JOCONDE&body=Bonjour,%0D%0A%0D%0A'>Contact musée</A>|Marina Zveguinzoff|© Direction des musées de France||||||||Italie (méridionale, lieu de découverte)|amphore||sur col : ornementation (guirlande, feuille, laurier, ove, languette)#sur épaule : ornement à forme végétale (palmette, fleur de lotus, frise, poste orn)#sur panse : représentation d'objet (registre, poste orn)#sur panse (face A, en haut) : scène : figure (femme, chignon, bijou, péplos, écharpe, oiseau, femme, chignon, péplos, jeune homme, nu, garçon, assis, pilier)#sur panse (face A, en bas) : scène mythologique (Gorgone, Persée, nu, pétase, ?, pied, à ailette, tête, Méduse, sans tête, péplos, course, satyre, en appui, rocher) ; dans le champ : représentation végétale (arbuste)#sur panse (face B, en haut) : scène : figure (femme, chignon, bijou, péplos, écharpe, phiale, feuille, chêne, femme, chignon, collier, boucle d'oreille, péplos, chaussure, couronne, coffret, jeune homme, nu, situle, candélabre)#sur panse (face B, en bas) : scène (combat : (homme, nu, poignard, ?, homme, nu, draperie, épée, homme, barbe, ?, nu, draperie, lance)#sous anse : ornement à forme végétale (palmette, vol|REPR !ute, cornet orn, cercle, croisillon)#sur panse (en bas) : ornementation (méandre orn, croisillon)|H. ; D. 34.5|archéologie ; Céramique||classique ; figures rouges|||||non||Musée de France#au sens de la loi n°2002-5 du 4 janvier 2002|||Lucanie (lieu d'exécution)||Marseille ; musée d'Archéologie Méditerranéenne, Centre de la Vieille Charité|France ; Provence-Alpes-Côte d'Azur ; Bouches-du-Rhône||||M0919|2927|||4e quart 4e siècle AV JC|||||||||||||||Ancien fonds ; Marseille ; musée d'archéologie méditerranéenne, centre de la Vieille-Charité|argile ; peint ; dessin au trait||PEINTRE DE NAPLES 1959 : amphore|conservation des aliments||<A HREF='http://www.marseille.fr/vdm/cms/culture/musees' TARGET='_blank'>Site des musées</A>||||||||"
./data/joconde-MUSEES-valid.csv,23037,Line should have 77 collumn and has 78,"02120024739         ||||Métraille Louis Eugène (1869-1941)|||Péan René Louis (affichiste) ; Chaix (imprimeur)|du Musée de Bretagne. [S.l. , s.n.], 1983. 2 vol ([246] f. - XLIII f. de pl.-[12] f. ). Mém. : Hist. Art : Rennes 2 : 1983 (I, n° 200, f. 240) ; N° 1, 'le musée de Bretagne pour quoi faire ? ', p. 33 (N° spécial : 'La Bretagne de la fin du 19e siècle, 1979 ; ill. , p. 20) ; régionalisme, voyages à travers l'affiche : un siècle de création. Neuilly, F. Lozada, 1996. [Non paginé] (N° 138) ; Rennes, Apogée, musée de Bretagne, 1996. 285 p (P. 86 ; p. 87 : ill.) ; 1880-1930. Plouër-sur-Rance, Bleu b, 1997. 80 p (N° 29, p. 67)|Sur l'imprimerie Chaix, voir 933.32.22 rubrique Fonctionnement & contexte. Voir lettre des A. M. Saint-Malo, 15.05.1995|<A HREF='mailto:museebzh@leschampslibres.fr?Subject=Contact base JOCONDE&body=Bonjour,%0D%0A%0D%0A'>Contact musée</A>|Mathilde Huet|© Rennes, Musée de Bretagne, © Direction des musées de France, 2002||1933|||2002/03/18||||affiche|représente une jeune femme vue de profil en tenue de bain. Elle tient dans sa main droite, son chapeau et dans sa main gauche, une serviette rouge. A l'arrière plan un imposant édifice est assis en bordure de l'océan (il s'agit du casino), deux hommes la regarde passer avec beaucoup d'intérêt|scène (femme, debout, de profil, costume de bain (rayure)) ; fond de paysage (Saint-Malo, plage, casino, baignade)|H. 129.5 ; l. 91.5|imprimé ; balnéaire||||Collectionneur d'affiches ; Palais des arts & du festival, Dinard, 27/06/1997 au 21/08/1997|||oui|@{video;/eth/0007/m021202_0018159_p.jpg;joc}@|Musée de France#au sens de la loi n°2002-5 du 4 janvier 2002|signature ; nom d'imprimeur inscrit||Paris (lieu d'exécution)||Rennes ; musée de Bretagne|France ; Bretagne ; Ille-et-Vilaine||1900 vers||M0212|933.0032.291 ; 13268 (Autre N° 1)|||1er quart 20e siècle||© Houssin Jean-Claude ; © Prudor Gérard|<A HREF='mailto:museebzh@leschampslibres.fr?Subject=Commande&body=Bonjour,%0D%0A%0D%0AEn provenance de la base JOCONDE - Demande de photographie et/ou de conditions d'utilisation de :%0D%0Aimprimé ; balnéaire ; ethnologie : Plage de Saint-Malo / (Bretagne) / Péan René Louis (affichiste) ; Chaix (imprimeur). - N°INV=933.0032.291 ; 13268 (Autre N° 1)%0D%0A%0D%0AMerci.'>Demande de photographie et/ou de conditions d'utilisation</A><A HREF='mailto:museebzh@agglo-rennesmetropole.fr?Subject=Commande&body=Bonjour,%0D%0A%0D%0AEn provenance de la base JOCONDE - Demande de photographie et/ou de conditions d'utilisation de :%0D%0Aimprimé ; balnéaire ; ethnologie : Plage de Saint-Malo / (Bretagne) / Péan René Louis (affichiste) ; Chaix (imprimeur). - N°INV=933.0032.291 ; 13268 (Autre N° 1)%0D%0A%0D%0AMerci.'>Demande de photographie et/ou de conditions d'utilisation</A>|Péan : Peintre,lithographe, illustrateur et affichiste français (Paris 1875 - ?). Elève de Jules Chéret et de l'Ecole des Arts décoratifs. Il travaille pour l'imprimerie Chaix entre 1890 et 1905 en créant des affiches de théâtre et de cabaret. Sa production d'affiches est assez considérable, il aborde à peu près tous les secteurs de la publicité: théâtre, grand-magasin, tourisme...etc. Il exerce aussi ses talents en tant que dessinateur de presse et collabore au 'Sourire', à 'L'Illustration', 'La Rampe'...Un de ses dessins figure dans la série de cartes postales 'Collection des cent'. La femme paraît l'avoir beaucoup inspiré tout comme son maître Jules Chéret, mais il a su se dégager suffisamment de son influence pour créer son style propre: toujours élégantes et séduisantes, les femmes de Péan sont dynamiques, bien présentes en chair et en os à l'opposé des silhouettes fugitives de Chéret. Pastelliste et peintre, il a été séduit par l'Espagne, pays qu'il a évoqué à travers sa peinture par |PAUT    !des portraits de danseuses et chanteuses espagnoles. L.P 19/XII/1995#Imprimerie parisienne fondée par Jules Chéret en 1866 et cédée à la maison Chaix en 1881|||Sur cette affiche on peut lire de haut en bas : - 'Plage de St.-Malo' (en gros caractères rouges) - '(Bretagne) Casino'. - 'Bains de mer...Billets d'aller et retour...'. Signature en bas à droite: René Péan Imp. Chaix Paris|20 rue Bergère||||M021202_0018159_P.JPG,DS1,,0018159.JPG|||propriété de la commune ; don ; Rennes ; Musée de Bretagne|papier ; chromolithographie|Plage de Saint-Malo / (Bretagne)|Péan René Louis (affichiste), Chaix (imprimeur) : <I>Plage de Saint-Malo / (Bretagne)</I>|publicité (casino, Saint-Malo)|/eth/0007/m021202_0018159_p.jpg;/eth/0007/m021202_0018159_v.jpg|<A HREF='http://www.bretagne-musees.culture.fr/' target='_blank'>Site associé</A>||||||||"
./data/joconde-MUSEES-valid.csv,129785,Line should have 77 collumn and has 78,"01810001828         ||||FALCONET|||GREUZE Jean-Baptiste|- Jean-Baptiste Greuze (1725-1805) et les collections du musée Greuze de Tournus Hôtel-Dieu - Musée Greuze Tournus Christelle Rochette Juin 2000 115 pages (Christelle Rochette, 13 p.68) ;#- Jean Martin, Catalogue du Musée de Tournus (Musée Greuze), Tournus, SAAST, 1910. 230 pages. (Marin, 8 p.51) ;#| Jean Martin, Catalogue du Musée de Tournus, Mâcon, 1886. 98 pages (Martin, n° 8 p.27, sous le titre Un sacrifice) ;#- Jean Martin et Charles Masson, Catalogue raisonné de l'oeuvre peint et dessiné de Jean-Baptiste Greuze, suivi de la liste des gravure exécutées d'après ses ouvrages. Paris, 1908 (Martin-Masson, n° 34)||<A HREF='mailto:hotel.dieu.tournus@wanadoo.fr?Subject=Contact base JOCONDE&body=Bonjour,%0D%0A%0D%0A'>Contact musée</A>|Jeannette Ivain|© Tournus, musée Greuze, © Direction des musées de France, 2004||1868||2004/07/02|2004/06/11|||||Crayon rouge sur papier blanc|scène (homme : à l'antique, bélier, vase, fauteuil)|H. 26.5 ; L. 38.5|dessin|France||||oeuvre en rapport ; étude|Etude du jugement de Sainte Cécile de Saint-Louis-des-Français|oui|@{video;/0059/m018104_0000314a_p.jpg;joc}@|Musée de France#au sens de la loi n°2002-5 du 4 janvier 2002|monogramme||Italie : Rome (lieu de création)||Tournus ; musée Greuze|France ; Bourgogne ; Saône-et-Loire||1756 entre ; 1757 et||M0181|82.1508|||3e quart 18e siècle||© Christelle Rochette|<A HREF='mailto:hotel.dieu.tournus@wanadoo.fr?Subject=Commande&body=Bonjour,%0D%0A%0D%0AEn provenance de la base JOCONDE - Demande de photographie et/ou de conditions d'utilisation de :%0D%0Adessin : Scène antique / GREUZE Jean-Baptiste. - N° inv. : 82.1508%0D%0A%0D%0AMerci.'>Demande de photographie et/ou de conditions d'utilisation</A>|Tournus, 1725 ; Paris, 1805|||monogramme en bas à droite : G||Un personnage vêtu à la romaine, assis sur une chaise curule, désigne de la main droite un homme qui avance vers lui en tirant un bélier|||M018104_0000314a_P.JPG,DS1,,0000314a.JPG|||propriété de la commune ; achat ; Tournus ; musée Greuze|sanguine, crayon (rouge), papier|Scène antique|GREUZE Jean-Baptiste : <I>Scène antique</I>||/0059/m018104_0000314a_p.jpg;/0059/m018104_0000314a_v.jpg|<A HREF='http://www.musees-bourgogne.org/' target='_blank'>Musées en Bourgogne</A>||||||||"
./data/joconde-MUSEES-valid.csv,295107,Line should have 77 collumn and has 91,"M0354000194         |||||||anonyme|jeux et jouets anciens, Musée Municipal, SAINT-DIE||<A HREF='mailto:musee-champlitte@cg70.fr?Subject=Contact base JOCONDE&body=Bonjour,%0D%0A%0D%0A'>Contact musée</A>|Mathilde Huet|© musée départemental Albert Demard, Champlitte, 2003, © Direction des Musées de France, 2007|||||2007/11/16||||domino (lot, 14)|14 pièces en ivoire et en bois teinté noir. Les deux parties sont reliées entre elles par une semence dont le tête et la pointe applaties apparaissent de chaque côté de la pièce. La valeur de chacune des pièces est inscrite par incrustations dans l'ivoire, lesquelles sont en creux et teintées en noir. Les 14 pièces sont : 0|0 ; 2|0 ; 6|5 ; 0|1 ; 0|5 ; 6|6 ; 4|3 ; 6|2 ; 6|0 ; 5|3 ; 3|1 ; 5|5 ; 6|3 ; 6|1||H. 1,2 cm ; l. 2,2 cm ; L. 5 cm|jeux - sports - loisirs|||Etat moyen, 23/09/2004||||Oui|@{video;/0374/m035427_01126_p.jpg;joc}@|Musée de France#au sens de la loi n°2002-5 du 4 janvier 2002|numéro||||Champlitte ; musée départemental Albert Demard|France ; Franche-Comté ; Haute-Saône||1850 entre ; 1950 et||M0354|D-ATP-97-25-24|||2e moitié 19e siècle ; 1ère moitié 20e siècle||© BERNARDOT Claude-Henry|<A HREF='mailto:musee-champlitte@cg70.fr?Subject=Commande&body=Bonjour,%0D%0A%0D%0AEn provenance de la base JOCONDE - Demande de photographie et/ou de conditions d'utilisation de :%0D%0Ajeux - sports - loisirs. - N°INV=D-ATP-97-25-24%0D%0A%0D%0AMerci.'>Demande de photographie et/ou de conditions d'utilisation</A>||||6, 3 ; 2, 1 ; 5, 5 ; ..||||CHAPUIS Catherine ; POULAIN Nicolas|M035427_01126_P.JPG,DS1,,01126.JPG|||propriété du département ; Haute-Saône ; don ; musée départemental Albert Demard|bois, ivoire||anonyme : domino (lot, 14)|jeu|/0374/m035427_01126_p.jpg;/0374/m035427_01126_v.jpg|<A HREF='http://www.musees-franchecomte.com/' target='_blank'>musées en Franche-Comté</A>||||||||"
./data/joconde-MUSEES-valid.csv,404232,Line should have 77 collumn and has 78,"08070000173         ||||Collection privée, Schloesing de Dietrich H., 1939, ?, (Don au musée Calvin d'après Pannier 1939, n°72 p.23. La Société de l'Histoire du Protestantisme Français, propriétaire du musée et gestionnaire de celui-ci en 1939, fut le bénéficiaire du don.)|||DEVERIA Eugène|Garreau-Gallot (Sophie), Souvenir d'Eugène Devéria, Tarbes, 1868 (p.69)#Doumergue (Emile), Iconographie calvinienne comprenant un Catalogue descriptif des portraits gravés de Calvin établi par le Dr Hector Maillart-Gosse, Lausanne, Georges Bridel & Cie éditeurs, 1909. (p.253, n°290 et suivants (Le tableau de Hornung))#'Eugène Devéria (Paris 1805 - Pau 1865)', catalogue de l'exposition [Pau, musée des Beaux-Arts, 29 octobre - 31 décembre 1965], Pau, 1965. (p. 55, cat. 130 (étude pour le tableau de Noyon))#Pannier, Jacques, Catalogue de la maison de Calvin, musée historique des églises protestantes du Nord à Noyon, [Paris], [Société d'Histoire du Protestantisme Français], [1939]. (N°72 du catalogue, p. 23.)#Angély (René), La vie pyrénéenne d'Eugène Devéria, Pau, 1940 (Autoportrait reproduit)#Chaunu (Pierre) [sous la direction de], L'aventure de la Réforme. Le monde de Jean Calvin, Paris, Hermé et Desclée de Brouwer, 1986. (pp. 248-249 : rep. du tableau de Joseph Hornung.)#'Les années romantiques. La peinture française de 1815 à 1850', catalogue de l'exposition [Nantes, Musée des Beaux-Arts, 4 décembre 1995 - 17 mars 1996 ; Paris, Galeries nationales du Grand Palais, 16 avril - 15 juillet 1996 ; Plaisance, Palazzo Gotico, 6 septembre - 17 novembre 1996], Paris, Editions de la Réunion des musées nationaux, 1995. (Planche 177 (rep.) et pp. 376 à 379)#Panni (Frédéric), Roussel (Bernard) et Gilmont (Jean-François), Jean Calvin (Noyon 1509 - Genève 1564) et le musée Jean-Calvin de Noyon, Noyon, Société des amis du musée Jean-Calvin de Noyon, 2000. (p. 45 (reproduction).)#Eugène Devéria 1805-1806, catalogue des expositions [Eugène Devéria, la peinture et l'histoire, musée national du château de Pau ; Eugène Devéria, variations sur les genres artistiques, Musée des Beaux-Arts de Pau ; 17 décembre 2005 - 19 mars 2006], éditions de la RMN, 2005. (cat. 95)||<A HREF='mailto:conserv.musees@noyon.fr?Subject=Contact base JOCONDE&body=Bonjour,%0D%0A%0D%0A'>Contact musée</A>|Jeannette Ivain|© Noyon, musée Calvin, © Direction des musées de France, 2009|||1960||2009/10/21|1564/04/27|||tableau||scène historique (Calvin, Calvin Jean, homme de lettres, Français, théologien : protestantisme, homme, couché, lit, bonnet, linge de corps, expression orale, désigner, livre, groupe, homme, noblesse, Devéria Eugène, réflexion, vieillard, magistrat, attention, assis, attribut, bâton, fauteuil, chambre, étagère, livre)|Hauteur hors cadre en cm 80 ; Largeur hors cadre en cm 102 ; Hauteur avec cadre en cm 115 ; Largeur sans cadre en cm 135|peinture|France|||'Les années romantiques, la peinture française de 1815 à 1830', Nantes, musée des Beaux-Arts, 6 décembre 1995-17 mars 1996. (Exposition présentée à Paris, aux galeries nationales du Grand Palais, du 16 avril au 15 juillet 1996, et à Piacenza, Palazzo Gotico, du 6 septembre au 15 juillet 1996.)#Noyon, musée Calvin, 2002 : Aspects de la Réforme#Eugène Devéria, la peinture et l'histoire, Pau, exposition du 17 décembre 2005 au 19 mars 2006, musée national du château de Pau. (cat. 95)|objet en rapport|D'après Sophie Garreau-Gallot [bibl. 1865, p.69] : L'une des dernières oeuvres d'Eugène Devéria fut les adieux de Calvin aux syndics de Genève ; il s'est représenté dans le personnage d'un syndic. Un autoportrait contemporain de l'exécution du tableau de Noyon, reproduit dans [bibl. Angély R. 1940], permet d'identifier avec le peintre le second personnage debout en partant de la gauche dans : Les adieux de Calvin. C'est à Edimbourg que Devéria eut l'idée de faire un tableau sur ce sujet, d'après son 'Journal' du 31 décembre 1849 ; il n'y fait plus allusion ensuite. [Lettre de Monique Geiger, conservateur au musée des Beaux-Arts de Dijon, à J. Depouilly, conservateur du musée de Soissons, du 5 mars 1967]. Le musée des Beaux-Arts de Pau conserve une étude (lavis de sépia, 15 x 20 cm - inv. n°D. 54.1.2.) préparatoire au tableau du musée Jean Calvin [voir cat. exp. Pau, musée des Beaux-Arts, 1965, cat. 130]. Devéria s'est directement inspiré du tableau que Joseph Hornung (1792 - 1870) a peint en 1829, 'Les adieux de Calvin aux quatre syndics et aux seigneurs de Genève le 27 avril 1564', conservé à la Bibliothèque publique et universitaire de Genève (rep. in Chaunu P. 1986 : L'aventure de la Réforme) ; Date : Dans son journal (manuscrit conservé à la Bibliothèque municipale de Pau), à la date du 31 décembre 1849, Devéria, alors en Ecosse, indique qu'il veut faire un tableau de demi-figures sur ce sujet [voir cat. exp. Pau, musée des Beaux-Arts, 1965, p.55, cat. 130 (étude pour la peinture de Noyon)]. Précédemment daté vers 1850, il convient aujourd'hui de proposer une nouvelle datation, bien plus tardive, et de le dater vers 1863 en rapport à son autoportrait de 1863 [cat. expo. Pau, musée des Beaux-Arts, 2005, cat. 96] ; ce même autoportrait de Devéria est en effet 'inséré' au milieu des figurants assistant aux adieux de Calvin. ; voir aussi : Les adieux de Calvin aux quatre syndics et aux seigneurs de Genève le 27 avril 1564 (MC 94), Les adieux de Calvin aux quatre syndics et aux seigneurs de Genève le 27 avril 1564 (MC 92) ; en rapport avec : Devéria E. : autoportrait|Oui|@{video;/0489/m080786_0003685_p.jpg;joc}@|Musée de France#au sens de la loi n°2002-5 du 4 janvier 2002|inscription|dépôt ; musée Calvin|? (lieu de création)||Noyon ; musée Calvin|France ; Picardie ; Oise||1863||M0808|MC 6 ; II2.2 (MC Inv. 1960 n°)|||3e quart 19e siècle||© Moulic, © Garrigou|<A HREF='mailto:conserv.musees@noyon.fr?Subject=Commande&body=Bonjour,%0D%0A%0D%0AEn provenance de la base JOCONDE - Demande de photographie et/ou de conditions d'utilisation de :%0D%0Apeinture : Les adieux de Calvin aux quatre syndics et aux seigneurs de Genève le 27 avril 1564 (Titre attribué au tableau de Joseph Hornung (1829, Bibliothèque publique et universitaire de Genève), source de l'oeuvre de Devéria. ) ; Les adieux de Calvin aux syndics de Genève (Titre attribué à l'étude pour le tableau de Noyon in Cat. exp. Pau 1965 : Eugène Devéria (cat. 130). ) ; La mort de Calvin (Titre familièrement attribué au tableau. ) / DEVERIA Eugène. - N°INV=MC 6 ; II2.2 (MC Inv. 1960 n°)%0D%0A%0D%0AMerci.'>Demande de photographie et/ou de conditions d'utilisation</A>|DEVERIA : Paris, 1805/04/22 ; Pau, 1865/02/02|||Non signé ni daté. Inscrit sur le cartel en cuivre fixé sur le cadre : LA MORT DE J. CALVIN | En mémoire du Pr Ch. L. Frossard. Etiquette collée sur le cadre : 72||Devéria transforme la présentation frontale, volontairement archaïsante, de Hornung, en représentant de profil le lit mortuaire et en installant des 'repoussoirs' dans les premiers plans. Non répertorié in Doumergue 1909.|||M080786_0003685_P.JPG,DS1,,0003685.JPG|||propriété privée personne morale ; société de l'Histoire du Protestantisme français|toile, peinture à l'huile|Les adieux de Calvin aux quatre syndics et aux seigneurs de Genève le 27 avril 1564 (Titre attribué au tableau de Joseph Hornung (1829, Bibliothèque publique et universitaire de Genève), source de l'oeuvre de Devéria. ) ; Les adieux de Calvin aux syndics de Genève (Titre attribué à l'étude pour le tableau de Noyon in Cat. exp. Pau 1965 : Eugène Devéria (cat. 130). ) ; La mort de Calvin (Titre familièrement attribué au tableau. )|DEVERIA Eugène : <I>Les adieux de Calvin aux quatre syndics et aux seigneurs de Genève le 27 avril 1564 (Titre attribué au tableau de Joseph Hornung (1829, Bibliothèque publique et universitaire de Genève), source de l'oeuvre de Devéria. ), Les adieux de Calvin aux syndics de Genève (Titre attribué à l'étude pour le tableau de Noyon in Cat. exp. Pau 1965 : Eugène Devéria (cat. 130). ), La mort de Calvin (Titre familièrement attribué au tableau. )</I>||/0489/m080786_0003685_p.jpg;/0489/m080786_0003685_v.jpg|||||DEVERIA EUGENE||DEVERIA EUGENE||"
./data/joconde-MUSEES-valid.csv,404230,Line should have 77 collumn and has 78,"08070000174         ||||Collection privée, Burkhardt Jacob, 19ème s., Bâle, (D'après Emile Doumergue (1909), le portrait, propriété de Jakob Burckhardt, passa à la mort de celui-ci dans la collection de son gendre Oeri, puis à la mort de ce dernier dans celle du petit-fils de M. Oeri, le Dr phil. Albert Oeri. Jakob Burckhardt, l'un des plus éminents historiens de l'art du 19e siècle, était collègue du philosophe Friedrich Nietzsche lorsque celui-ci était en poste à l'Université de Bâle de 1868 à 1878) ; Collection privée, Oeri-Burckardt Joh. Jakob, 1897, Bâle ; Collection privée, Oeri-Sarazin, 1897, Bâle, (Le docteur Oeri-Sarazin fut chargé par la famille Oeri, bénéficiaire de la succession Oeri-Burkhardt, de vendre le portrait de Calvin dit de Bâle. Il reçut une proposition d'achat le 28 décembre 1897 de la part de la Société d'Histoire du Protestantisme Français. L'offre ne connut pas de suite en raison du prix demandé par la famille Oeri : 20000 Frs. [Archives de la S.H.P.F., correspondance datée 28.12.1897, 08.01.1898 et 24.01.1898, copie dans la documentation du musée].) ; Oeri-Archiv Stiftung|||anonyme|Doumergue (Emile), Iconographie calvinienne comprenant un Catalogue descriptif des portraits gravés de Calvin établi par le Dr Hector Maillart-Gosse, Lausanne, Georges Bridel & Cie éditeurs, 1909. (pp.25-27)#Panni (Frédéric), Roussel (Bernard) et Gilmont (Jean-François), Jean Calvin (Noyon 1509 - Genève 1564) et le musée Jean-Calvin de Noyon, Noyon, Société des amis du musée Jean-Calvin de Noyon, 2000. (p. 31 (reproduction).)#'Humanistes chrétiens & Protestants de Picardie au 16e siècle'. Catalogue de l'exposition : musée Jean Calvin et galerie du Chevalet, du 10 juillet au 31 octobre 2009. Edition Ville de Noyon, 2009. (p.8 (reproduction))|achat avec l'aide de l'Etat|<A HREF='mailto:conserv.musees@noyon.fr?Subject=Contact base JOCONDE&body=Bonjour,%0D%0A%0D%0A'>Contact musée</A>|Jeannette Ivain|© Noyon, musée Calvin, © Direction des musées de France, 2009||1985 acquis ; 1984 entrée matérielle|||2009/10/21|1509 né ; 1564 mort|||tableau|Reliure en parchemin ; Reliure de l'époque (?) en parchemin. Page de titre. Encadrement gravé sur bois (132x83 mm) constitué d'une frise de motifs végétaux, de masques, de monstres et d'animaux. En haut, vignette (31x29mm) représentant saint Jérôme dans son cabinet.#Foliotage en chiffres arabes dans le titre courant, côté gouttière dans une position irrégulière autour de l'axe de la justification. Illustrations : Texte imprimé en rouge et noir, lettres ornées env. 20x20 mm. Très nombreuses illustrations, scènes gravées sur bois (souvent env. 35x30mm) et trois gravures pleine page##|portrait (Calvin, Calvin Jean, homme de lettres, Français, théologien : protestantisme, homme, en buste, de trois-quarts, bonnet, manteau, col, fourrure)|Hauteur hors cadre en cm 53 ; Largeur sans cadre en cm 40 ; Hauteur avec cadre en cm 61.2 ; Largeur avec cadre en cm 49.8|peinture|||||objet en rapport|Tableau exécuté d'après un portrait de Calvin gravé ou peint au 16e ou au 17e [Doumergue 1909, p.27] ; cette oeuvre est à rapprocher de la gravure d'Hugo Allardt (Noyon, musée Calvin, inv. MC 48), graveur hollandais actif à la fin du 17e siècle ; Gravure reproduite in Pannier J., 1939, p.28. ; voir aussi : Portrait de Jean Calvin (MC 10)|Oui|@{video;/0489/m080786_0001929_p.jpg;joc}@|Musée de France#au sens de la loi n°2002-5 du 4 janvier 2002|inscription (latin)||||Noyon ; musée Calvin|France ; Picardie ; Oise||||M0808|MC 1|||17e siècle (?) ; 18e siècle (?)||© Noyon, musée du Noyonnais|<A HREF='mailto:conserv.musees@noyon.fr?Subject=Commande&body=Bonjour,%0D%0A%0D%0AEn provenance de la base JOCONDE - Demande de photographie et/ou de conditions d'utilisation de :%0D%0Apeinture : Portrait de Jean Calvin dit de Bâle / anonyme. - N°INV=MC 1%0D%0A%0D%0AMerci.'>Demande de photographie et/ou de conditions d'utilisation</A>||||Inscription peinte en noir au pinceau en haut : IOH. CALVINUS | S.S.TH.DOCTOR.|||||M080786_0001929_P.JPG,DS1,,0001929.JPG|16e siècle (?) ; 17e siècle (?)||propriété de la commune ; achat avec participation ; Noyon ; musée Calvin|toile, peinture à l'huile|Portrait de Jean Calvin dit de Bâle|anonyme : <I>Portrait de Jean Calvin dit de Bâle</I>||/0489/m080786_0001929_p.jpg;/0489/m080786_0001929_v.jpg|||||||||"
